{
  "Vorname": "Marco",
  "Name": "Rieben",
  "Hauptrolle": "Projektleiter",
  "Nationalität": "Schweiz",
  "Hauptausbildung": "Informatik",
  "Kurzprofil": "Marco Rieben ist ein erfahrener Projektleiter und Business Analyst mit langjähriger Erfahrung in der digitalen Transformation internationaler Unternehmen. Sein Schwerpunkt liegt auf modernen Daten- und Analytics-Architekturen sowie der End-to-End-Umsetzung – von der Anforderungserhebung bis zur erfolgreichen Implementierung. Marcos technologischer Schwerpunkt umfasst moderne Datenplattformen (Snowflake, dbt, SQL, ETL/DWH), Analytics-Tools (Qlik, Power BI, Tableau) sowie Event-Streaming- und Low-Code-Ansätze. Marco verfügt über umfassende Erfahrung in der Führung und Koordination von global verteilten Teams und im Einsatz agiler Methoden wie Scrum und SAFe. Seine Arbeitsweise ist geprägt von analytischem Denken, klarer Struktur und wirksamem Stakeholder-Management. Er übersetzt komplexe Anforderungen in nachhaltige, skalierbare Lösungen und fördert durch seine Teamorientierung und Kommunikationsstärke eine konstruktive Zusammenarbeit. Er spricht fliessend Deutsch, Englisch und Italienisch sowie zusätzlich Spanisch und Französisch auf Konversationsniveau.",
  "Fachwissen_und_Schwerpunkte": ["Snowflake", "Power BI", "SQL", "dbt", "ETL/DWH", "Qlik", "Tableau", "Event-Streaming", "Scrum", "SAFe", "Low-Code Platforms", "Cloud Architecture"],
  "Aus_und_Weiterbildung": ["Scrum Master", "PM Ausbildung"],
  "Trainings_und_Zertifizierungen": ["SnowPro", "IREB"],
  "Sprachen": ["Deutsch", "Englisch"],
  "Referenzprojekte": ["Projekt A", "Projekt B"]
}
